{
  "$comment": "GENERATED by contracts/codegen/generate.py from telemetry_event.schema.yaml - DO NOT EDIT.",
  "$schema": "https://json-schema.org/draft/2020-12/schema",
  "additionalProperties": true,
  "description": "God's-view live telemetry event emitted by the coordinator (CONTRACT \u00a71.2/\u00a76).",
  "properties": {
    "cams": {
      "description": "Cameras that acked (for started); the phantom-press gate inputs.",
      "items": {
        "type": "string"
      },
      "type": "array"
    },
    "emitted_at": {
      "description": "Fob NTP wallclock (authoritative; \"\" before the first sync \u2014 present but may be empty).",
      "type": "string"
    },
    "episode_id": {
      "description": "The episode (for started/stopped/recording_suspect).",
      "type": [
        "string",
        "null"
      ]
    },
    "episode_ordinal": {
      "description": "The fob label ordinal.",
      "type": "integer"
    },
    "event": {
      "description": "The discriminator \u2014 which telemetry event this is.",
      "enum": [
        "started",
        "stopped",
        "camera_dropped",
        "recording_suspect"
      ],
      "type": "string"
    },
    "fob_session_id": {
      "description": "Random per fob boot; the fob-swap disambiguation key.",
      "type": "string"
    },
    "kit_id": {
      "description": "The kit this event is about (HARD-non-empty).",
      "minLength": 1,
      "type": "string"
    },
    "ms": {
      "description": "Fob uptime (monotonic within one fob_session_id); the always-present timing anchor.",
      "type": "integer"
    },
    "prompt": {
      "description": "Task prompt at press time.",
      "type": "string"
    },
    "schema": {
      "description": "Schema identifier.",
      "enum": [
        "eunomia-telemetry-event/v1"
      ],
      "type": "string"
    },
    "sent": {
      "description": "Cameras acked (the phantom-press gate: sent==2 required to advance the ordinal).",
      "type": "integer"
    },
    "side": {
      "description": "Which camera (for camera_dropped).",
      "enum": [
        "left",
        "right"
      ],
      "type": "string"
    },
    "station": {
      "description": "Station at press time.",
      "type": "string"
    },
    "total": {
      "description": "Cameras targeted.",
      "type": "integer"
    }
  },
  "required": [
    "schema",
    "event",
    "kit_id",
    "ms",
    "emitted_at"
  ],
  "title": "TelemetryEvent",
  "type": "object"
}
